{
  "layout": "guided question container opening into comparable professional profiles",
  "lineage": {
    "generated_asset": false,
    "origin": "original-abstract-spec",
    "source_assets_used": false
  },
  "motion": "step continuity and visible request feedback",
  "pattern": "service match flow with human proof, progressive questions, and clear request state",
  "primary": "#f7f6ff",
  "radius": "14px",
  "schema_version": "1.0",
  "secondary": "#2f2bff"
}
