{
  "layout": "radial-safe stack centered inside curved bounds",
  "lineage": {
    "generated_asset": false,
    "origin": "original-abstract-spec",
    "source_assets_used": false
  },
  "motion": "brief wrist-appropriate confirmation",
  "pattern": "round glanceable display with one metric, one status, and one reachable action",
  "primary": "#111418",
  "radius": "28px",
  "schema_version": "1.0",
  "secondary": "#a8c7fa"
}
